Título,Autor,Ano,Tipo,Prioridade,Status,Disponivel,Categoria,Motivacao,Nota,Data_Leitura,Score
Build a Large Language Model (From Scratch),Sebastian Raschka,2024,Técnico,4 - Alta,2,PDF,Sistemas de IA & LLMs,,,,29
1984,George Orwell,1949,Não Técnico,4 - Alta,0,Estante,Épicos & Ficção Reflexiva,Distopia clássica sobre totalitarismo,5.0,2025/01,25
Python Fluente,Luciano Ramalho,2023,Técnico,4 - Alta,1,Online,Artesanato de Software (Clean Code),https://pythonfluente.com/2/,,,26
Low-Code AI: A Practical Project-Driven Introduction to Machine Learning,Stripling,2023,Técnico,4 - Alta,1,,Engenharia de ML & MLOps,Introdução prática ao Machine Learning usando plataformas low-code. IA e MLOps,,,30
"Pai Rico, Pai Pobre",Robert Kiyosaki,1997,Não Técnico,4 - Alta,1,Estante,Liberdade Econômica & Finanças,Fundamentos de educação financeira e investimentos.,,,27
Generative Deep Learning,David Foster,2023,Técnico,4 - Alta,1,PDF,Sistemas de IA & LLMs,,,,30
Simple SQL,Preston Prescott,2015,Técnico,4 - Alta,1,PDF,Storytelling & Visualização,"O domínio de SQL é uma habilidade fundamental para qualquer profissional de dados, análise ou desenvolvimento. Este livro proporciona uma base para manipular e extrair informações, sendo crucial no seu dia a dia.",,,26
Image classification with AutoKeras,Manning live project,0,Técnico,4 - Alta,1,,Machine learning,,,,25
Think Stats,Allen B. Downey,2025,Técnico,4 - Alta,1,PDF,Estatística & Incerteza,https://allendowney.github.io/ThinkStats/index.html,,,30
Machine Learning Yearning,Andrew Ng,2018,Técnico,4 - Alta,1,PDF,Sistemas de IA & LLMs,Dominar os pilares fundamentais da inteligência artificial moderna.,,,28
Automated machine learning in action,Qingquan Song et al.,0,Técnico,4 - Alta,1,,Engenharia de ML & MLOps,Dominar os pilares fundamentais da inteligência artificial moderna.,,,25
Sobre a escrita: A arte em memórias ,Stephen King,2015,Não Técnico,4 - Alta,1,,Épicos & Ficção Reflexiva,Explorar a fronteira tecnológica e seus impactos na sociedade.,,,24
"Hands-On Machine Learning with Scikit-Learn, Keras, and TensorFlow",Aurélien Géron,2022,Técnico,4 - Alta,1,,Machine learning,"Complementa o ""Deep Learning with Python"" do Chollet, oferecendo uma visão mais ampla e prática de ML em geral, com foco em implementação. Essencial para quem quer aplicar ML de forma eficaz.",,,30
Deep Learning,Ian Goodfellow & Yoshua Bengio & Aaron Courville,2016,Técnico,4 - Alta,1,PDF,Sistemas de IA & LLMs,,,,28
Machine Learning Engineering,Andriy Burkov,2020,Técnico,4 - Alta,1,,Sistemas de IA & LLMs,Aprofundar em engenharia de Machine Learning para produção.,,,30
Transformers for Natural Language Processing,Denis Rothman,2024,Técnico,3 - Média-Alta,1,PDF,Sistemas de IA & LLMs,,,,27
Sapiens: Uma Breve História da Humanidade,Yuval Noah Harari,2011,Não Técnico,4 - Alta,1,,Cosmologia & Fronteiras da Ciência,Ampla perspectiva sobre a história da humanidade e o futuro.,,,28
An Introduction to Statistical Learning,Gareth James,2023,Técnico,4 - Alta,1,PDF,Estatística & Incerteza,https://www.statlearning.com/,,,30
Eloquent JavaScript,Marijn Haverbeke,2024,Técnico,4 - Alta,1,,Artesanato de Software (Clean Code),https://eloquentjavascript.net/,,,26
Deep Learning for Computer Vision with Python (Practitioner Bundle),Adrian Rosebrock,2019,Técnico,4 - Alta,1,,Sistemas de IA & LLMs,Aprofundar conhecimentos em Deep Learning aplicado à Visão Computacional com Python.,,,30
Deep Learning for Computer Vision with Python (Starter Bundle),Adrian Rosebrock,2019,Técnico,4 - Alta,1,PDF,Sistemas de IA & LLMs,Aprofundar conhecimentos em Deep Learning aplicado à Visão Computacional com Python.,,,30
A Jornada do Escritor: Estrutura mítica para escritores,Christopher Vogler,2024,Não Técnico,4 - Alta,1,,Comunicação,,,,26
Guia Front-End: O caminho das pedras para ser um dev Front-End,Diego Eis,2015,Técnico,3 - Média-Alta,1,,Sistemas de IA & LLMs,Explorar a fronteira tecnológica e seus impactos na sociedade.,,,21
Feature Engineering for Machine Learning,"Alice Zheng, Amanda Casari",2018,Técnico,4 - Alta,1,PDF,Engenharia de ML & MLOps,Otimize modelos extraindo o melhor dos dados.,,,28
HTML5 e CSS3: Domine a web do futuro,Lucas Mazza,2014,Técnico,3 - Média-Alta,1,,Programação,,,,21
Machine Learning a first course for engineers and scientists,Andreas Lindholm et al.,0,Técnico,3 - Média-Alta,1,,Machine learning,Dominar os pilares fundamentais da inteligência artificial moderna.,,,22
An Introduction to Statistical Learning,Gareth James et al.,0,Técnico,3 - Média-Alta,1,,Estatística & Incerteza,,,,22
Inteligência Emocional,Daniel Goleman,1995,Não Técnico,4 - Alta,1,,Arquitetura da Mente (Mindset),Desenvolver a capacidade de gerenciar emoções e relacionamentos.,,,28
Designing Machine Learning Systems,Chip Huyen,2022,Técnico,4 - Alta,1,,Engenharia de ML & MLOps,Design de sistemas de ML em larga escala.,,,28
Computer Vision: Algorithms and Applications,Richard Szeliski,2021,Técnico,3 - Média-Alta,1,,Artesanato de Software (Clean Code),Compreender algoritmos e aplicações de visão computacional.,,,27
A Cor dos Dados: Um guia para o uso de cores em storytelling de dados,Kate Strachnyi,2023,Técnico,4 - Alta,1,,Storytelling & Visualização,Explorar a fronteira tecnológica e seus impactos na sociedade.,,,28
Practical MLOps,"Noah Gift, Alfredo Deza",2021,Técnico,4 - Alta,1,,Engenharia de ML & MLOps,Guia prático para implementar MLOps.,,,28
Data Science for Business,"Foster Provost, Tom Fawcett",2013,Técnico,4 - Alta,1,,Storytelling & Visualização,Como a ciência de dados pode ser aplicada para resolver problemas de negócios e gerar valor. Negócios e dados,,,28
Razão e Sensibilidade,Jane Austen,1811,Não Técnico,4 - Alta,1,Estante,Épicos & Ficção Reflexiva,Contraste entre lógica e emoção,,,25
Uma Breve História do Tempo,Stephen Hawking,1988,Técnico,3 - Média-Alta,1,PDF,Cosmologia & Fronteiras da Ciência,"Explora conceitos de cosmologia, buracos negros, universo e tempo de forma acessível. Ciência acessível sobre o universo",,,27
Business Intelligence: Implementar do jeito certo e a custo zero,Ronaldo Braghitton,2017,Técnico,4 - Alta,1,,Análise de Dados,Visualização de dados,,,26
Persuasão,Jane Austen,1817,Não Técnico,4 - Alta,1,Estante,Épicos & Ficção Reflexiva,Romance maduro e delicado,,,25
Data Analytics For Beginners,Victor Finch,2023,Técnico,3 - Média-Alta,1,,Estatística & Incerteza,"É o livro perfeito para quem está iniciando no universo de dados, oferecendo uma visão global e acessível que serve como um excelente ponto de partida na sua transição de carreira.",,,25
Soft skills: competências essenciais para os novos tempos,Lucedile Antunes,2020,Não Técnico,4 - Alta,1,,Sistemas de IA & LLMs,Explorar a fronteira tecnológica e seus impactos na sociedade.,,,24
Soft Skills - Vol 2: habilidades do futuro para o profissional do agora,Lucedile Antunes,2021,Não Técnico,4 - Alta,1,,Desenvolvimento pessoal,,,,24
Comunicação Não Violenta,Marshall Rosenberg,1999,Não Técnico,4 - Alta,1,,Comunicação,Melhorar a comunicação interpessoal no trabalho e na vida.,,,26
A Coragem de Não Agradar,"Ichiro Kishimi, Fumitake Koga",2013,Não Técnico,4 - Alta,1,,Arquitetura da Mente (Mindset),Libertar-se da necessidade de aprovação e viver autenticamente.,,,26
O Poder da Ação,Paulo Vieira,2017,Não Técnico,4 - Alta,1,,Arquitetura da Mente (Mindset),Transformar metas em realidade através de ações consistentes.,,,26
O Poder da Empatia,Brené Brown,2013,Não Técnico,4 - Alta,1,,Arquitetura da Mente (Mindset),Cultivar a empatia para melhorar relacionamentos e liderança.,,,26
JavaScript: O Guia Definitivo,David Flanagan ,2012,Técnico,2 - Média,1,,Sistemas de IA & LLMs,Explorar a fronteira tecnológica e seus impactos na sociedade.,,,18
A Sutil Arte de Ligar o F*da-se,Mark Manson,2016,Não Técnico,4 - Alta,1,,Desenvolvimento pessoal,Abordagem irreverente sobre felicidade e valores.,,,26
A Guerra da Arte,Steven Pressfield,2002,Não Técnico,4 - Alta,1,,Produtividade,Superar a resistência e a procrastinação na busca por objetivos criativos.,,,26
GPU Programming with C++ and CUDA: Uncover effective techniques for writing efficient GPU-parallel C++ applications,Paulo Motta,2025,Técnico,3 - Média-Alta,1,PDF,Artesanato de Software (Clean Code),,,,23
O Príncipe,Nicolau Maquiavel,1532,Não Técnico,3 - Média-Alta,1,,Liderança & Pensamento Estratégico,Compreender a natureza do poder e da liderança política.,,,25
A Arte da Guerra,Sun Tzu,0,Não Técnico,3 - Média-Alta,1,,Liderança & Pensamento Estratégico,Princípios de estratégia aplicáveis a diversas áreas da vida.,,,25
Comece pelo Porquê,Simon Sinek,2009,Não Técnico,3 - Média-Alta,1,,Liderança & Pensamento Estratégico,Descobrir o propósito para inspirar a si mesmo e aos outros.,,,25
Liderança sem Título,Robin Sharma,2010,Não Técnico,4 - Alta,1,,Liderança & Pensamento Estratégico,"Assumir a liderança em qualquer posição, sem depender de um título.",,,26
O Milagre da Manhã,Hal Elrod,2012,Não Técnico,4 - Alta,1,,Arquitetura da Mente (Mindset),Criar uma rotina matinal para maximizar o potencial diário.,,,26
O Poder do Hábito,Charles Duhigg,2012,Não Técnico,4 - Alta,1,,Arquitetura da Mente (Mindset),Entender a ciência por trás dos hábitos para melhorá-los.,,,26
O Poder da Vulnerabilidade,Brené Brown,2012,Não Técnico,4 - Alta,1,,Arquitetura da Mente (Mindset),Aprofundar na importância da vulnerabilidade para conexões autênticas.,,,26
A Coragem de Ser Imperfeito,Brené Brown,2012,Não Técnico,4 - Alta,1,,Arquitetura da Mente (Mindset),"Abraçar a vulnerabilidade, cultivar a autenticidade e superar a vergonha para uma vida plena.",,,26
Lógica de programação com Portugol,"Joice Barbosa Mendes, Rafael da Silva Muniz",2022,Técnico,3 - Média-Alta,1,,Programação,,,,23
Como Fazer Amigos e Influenciar Pessoas,Dale Carnegie,1936,Não Técnico,4 - Alta,1,,Sistemas de IA & LLMs,Desenvolver habilidades de comunicação e relacionamento interpessoal para o sucesso na vida e na carreira.,,,26
Atlas do coracao,Brene Brown,0,Não Técnico,3 - Média-Alta,1,PDF,Inteligência emocional,,,,20
Harry Potter e a Pedra Filosofal,J.K. Rowling,1997,Não Técnico,3 - Média-Alta,1,Estante,Épicos & Ficção Reflexiva,Início da jornada mágica de Harry,,,22
Harry Potter e a Câmara Secreta,J.K. Rowling,1998,Não Técnico,3 - Média-Alta,1,Estante,Épicos & Ficção Reflexiva,Segredos antigos e mistérios de Hogwarts,,,22
Harry Potter e o Prisioneiro de Azkaban,J.K. Rowling,1999,Não Técnico,3 - Média-Alta,1,Estante,Épicos & Ficção Reflexiva,Mistérios do passado e novos aliados,,,22
Harry Potter e o Cálice de Fogo,J.K. Rowling,2000,Não Técnico,3 - Média-Alta,1,Estante,Épicos & Ficção Reflexiva,Torneio perigoso e retorno de Voldemort,,,22
Designing Machine Learning Systems,Chip Huyen,2022,Técnico,3 - Média-Alta,1,,Engenharia de ML & MLOps,Dominar os pilares fundamentais da inteligência artificial moderna.,,,27
Harry Potter e a Ordem da Fênix,J.K. Rowling,2003,Não Técnico,3 - Média-Alta,1,Estante,Épicos & Ficção Reflexiva,Resistência contra o Ministério da Magia,,,22
O pensamento lateral,Edward de Bono,1970,Não Técnico,3 - Média-Alta,1,,Conhecimento geral,,,,20
Harry Potter e o Enigma do Príncipe,J.K. Rowling,2005,Não Técnico,3 - Média-Alta,1,Estante,Épicos & Ficção Reflexiva,Segredos sombrios de Voldemort,,,22
Harry Potter e as Relíquias da Morte,J.K. Rowling,2007,Não Técnico,3 - Média-Alta,1,Estante,Épicos & Ficção Reflexiva,Desfecho épico da saga,,,25
Jogador Nº 1,Ernest Cline,2011,Não Técnico,3 - Média-Alta,1,Estante,Épicos & Ficção Reflexiva,Ficção científica e cultura pop,,,25
Maisie Dobbs,Jacqueline Winspear,2003,Não Técnico,3 - Média-Alta,1,Estante,Sistemas de IA & LLMs,Detetive feminina no pós-guerra,,,22
Para Sempre,Kim e Krickitt Carpenter,2000,Não Técnico,3 - Média-Alta,1,Estante,História/Ficção,História real de amor e superação,,,22
Understanding deep learning,Simon J. S. Prince,0,Técnico,2 - Média,1,,Sistemas de IA & LLMs,,,,19
Practical Statistics for Data Scientists,"Peter Bruce, Andrew Bruce, Peter Gedeck",2020,Técnico,2 - Média,1,,Estatística & Incerteza,Reforçar os fundamentos estatísticos essenciais para a Ciência de Dados.,,,24
O Homem Mais Rico da Babilônia,George S. Clason,1926,Não Técnico,4 - Alta,1,,Liberdade Econômica & Finanças,Princípios atemporais de gestão financeira.,,,25
Ethics of Artificial Intelligence,Mark Coeckelbergh,2020,Não Técnico,3 - Média-Alta,1,,Sistemas de IA & LLMs,Compreender as implicações éticas da IA.,,,24
Building Machine Learning Pipelines,"Hannes Hapke, Catherine Nelson",2020,Técnico,2 - Média,1,,Engenharia de ML & MLOps,Dominar os pilares fundamentais da inteligência artificial moderna.,,,22
AI Ethics,"Anthony Casey, Anthony Niblett",2021,Não Técnico,3 - Média-Alta,1,,Sistemas de IA & LLMs,Visão jurídica e ética sobre IA.,,,24
Os Segredos da Mente Milionária,T. Harv Eker,2005,Não Técnico,4 - Alta,1,,Liberdade Econômica & Finanças,Mudar a mentalidade sobre dinheiro e riqueza.,,,25
O Mundo de Sofia,Jostein Gaarder,1991,Não Técnico,2 - Média,1,Estante,Sistemas de IA & LLMs,Introdução à história da filosofia de forma acessível.,,,24
Hábitos Atômicos,James Clear,2018,Não Técnico,3 - Média-Alta,1,PDF,Arquitetura da Mente (Mindset),Construir rotinas saudáveis e eficazes para estudos e vida pessoal.,,,23
Arquitetura Limpa,Robert C. Martin,2017,Técnico,3 - Média-Alta,1,,Artesanato de Software (Clean Code),Princípios para projetar sistemas de software com uma arquitetura sólida e flexível. Estruturação de projetos,,,23
Quem tem medo do feminismo negro?,Djamila Ribeiro,2018,Não Técnico,4 - Alta,1,,Justiça Social & Interseccionalidade,Aprofundar no feminismo e suas interseccionalidades.,,,24
Pequeno Manual Antirracista,Djamila Ribeiro,2019,Não Técnico,4 - Alta,1,,Justiça Social & Interseccionalidade,Compreender e combater o racismo estrutural.,,,24
Pense em Python,,0,Técnico,3 - Média-Alta,1,,Artesanato de Software (Clean Code),Excelência técnica na linguagem base para engenharia de dados e IA.,,,18
O Monge e o Executivo,James C. Hunter,1998,Não Técnico,3 - Média-Alta,1,,Liderança & Pensamento Estratégico,Aprender sobre liderança servidora e seus princípios.,,,23
Interseccionalidade,Carla Akotirene,2019,Não Técnico,4 - Alta,1,,Justiça Social & Interseccionalidade,Compreender as múltiplas camadas de opressão e privilégio e sua relevância para a justiça social.,,,24
Getting Things Done,David Allen,2001,Não Técnico,3 - Média-Alta,1,,Produtividade,,,,18
"Armas, Germes e Aço",Jared Diamond,1997,Não Técnico,2 - Média,1,,Cosmologia & Fronteiras da Ciência,Entender como a geografia e o ambiente moldaram as sociedades humanas.,,,22
O Gene Egoísta,Richard Dawkins,1976,Não Técnico,2 - Média,1,,Cosmologia & Fronteiras da Ciência,Perspectiva da evolução centrada nos genes.,,,22
A Origem das Espécies,Charles Darwin,1859,Não Técnico,2 - Média,1,,Cosmologia & Fronteiras da Ciência,Fundamentos da teoria da evolução e da biologia moderna.,,,22
Cosmos,Carl Sagan,1980,Não Técnico,2 - Média,1,,Cosmologia & Fronteiras da Ciência,Explorar o universo e a ciência de forma poética e inspiradora.,,,22
Assim Falou Zaratustra,Friedrich Nietzsche,1883,Não Técnico,2 - Média,1,,Conhecimento geral,"Explorar conceitos de super-homem, vontade de potência e eterno retorno.",,,22
O Andar do Bêbado,Leonard Mlodinow,2008,Não Técnico,2 - Média,1,,Cosmologia & Fronteiras da Ciência,Compreender o papel do acaso e da probabilidade na vida.,,,22
Decifrando Arquiteturas de Dados,,0,Técnico,2 - Média,1,,Análise de Dados,,,,17
Data Strategy,Bernard Marr,2017,Técnico,3 - Média-Alta,1,,Negócios,Pense como uma estrategista de dados.,,,22
Lean Analytics,"Alistair Croll, Benjamin Yoskovitz",2013,Técnico,3 - Média-Alta,1,,Estatística & Incerteza,Cresça mais rápido com dados e foco.,,,22
Frankenstein,Mary Shelley,1818,Não Técnico,2 - Média,1,Estante,Épicos & Ficção Reflexiva,"Pioneiro da ficção científica, reflexão sobre criação e responsabilidade.",,,19
A Garota no Trem,Paula Hawkins,2015,Não Técnico,2 - Média,1,Estante,História/Ficção,Thriller psicológico moderno,,,22
Assassinato no Expresso do Oriente,Agatha Christie,1934,Não Técnico,2 - Média,1,Estante,Épicos & Ficção Reflexiva,Um dos casos mais famosos de Poirot,,,19
Confissões de Arsène Lupin,Maurice Leblanc,1913,Não Técnico,2 - Média,1,Estante,Épicos & Ficção Reflexiva,Clássico francês do crime e mistério,,,19
Contra Herlock Sholmes,Maurice Leblanc,1910,Não Técnico,2 - Média,1,Estante,Épicos & Ficção Reflexiva,Paródia divertida de Sherlock Holmes,,,19
Morte na Mesopotâmia,Agatha Christie,1936,Não Técnico,2 - Média,1,Estante,Épicos & Ficção Reflexiva,Clássico do mistério e suspense,,,19
Morte no Nilo,Agatha Christie,1937,Não Técnico,2 - Média,1,Estante,Épicos & Ficção Reflexiva,Ambientação exótica e trama intrigante,,,19
O Ladrão de Casaca,Maurice Leblanc,1907,Não Técnico,2 - Média,1,Estante,Épicos & Ficção Reflexiva,Primeiras aventuras do lendário Arsène Lupin,,,19
O Verdadeiro Retorno de Arsène Lupin,Takashi Morita,2013,Não Técnico,2 - Média,1,Estante,História/Ficção,Releitura moderna de um clássico ladrão de casaca,,,22
Oliver Twist,Charles Dickens,1838,Não Técnico,2 - Média,1,Estante,Épicos & Ficção Reflexiva,Clássico da crítica social inglesa,,,19
O homem e seus símbolos, Carl G. Jung,2016,Não Técnico,1 - Baixa,1,,Comunicação,,,,15
Os Bilhões de Arsène Lupin,Takashi Morita,2013,Não Técnico,2 - Média,1,Estante,História/Ficção,História cheia de ação e reviravoltas,,,22
Três Ratos Cegos,Agatha Christie,1950,Não Técnico,2 - Média,1,Estante,Épicos & Ficção Reflexiva,Mistério envolvente com reviravoltas,,,19
Wild Cards - O Começo de Tudo,George R. R. Martin (org.),1987,Não Técnico,2 - Média,1,Estante,História/Ficção,Super-heróis realistas em universo alternativo,,,19
The Art of Statistics,David Spiegelhalter,2019,Técnico,1 - Baixa,1,,Estatística & Incerteza,Explora o pensamento estatístico e como interpretar dados no mundo real. Fundamentos estatísticos com clareza,,,21
The Book of Why,"Judea Pearl, Dana Mackenzie",2018,Técnico,1 - Baixa,1,,Estatística & Incerteza,"Explora o conceito de causalidade e inferência causal, indo além da correlação. Causalidade e inferência em ciência de dados",,,21
Too Big to Ignore,Phil Simon,2013,Técnico,1 - Baixa,1,,Conhecimento geral,Argumenta a importância estratégica dos dados e como eles se tornam uma vantagem competitiva. Dados como vantagem competitiva,,,21
"Estatística, Probabilidade e Aprendizado de Máquina,",Máiron C. S. Chaves,0,Técnico,1 - Baixa,1,,Machine learning,,,,16
Pattern Recognition and Machile Learning,Christopher M. Bishop,0,Técnico,1 - Baixa,1,,Machine learning,,,,16
Statistics: A Very Short Introduction,David J. Hand,2008,Técnico,1 - Baixa,1,,Estatística & Incerteza,Conceitos essenciais de estatística de forma concisa e clara. Conceitos estatísticos de forma resumida,,,21
Peopleware,"Tom DeMarco, Timothy Lister",1987,Técnico,1 - Baixa,1,,Liderança,"Gestão de equipes de desenvolvimento de software, cultura e produtividade. Soft skills para devs",,,21
Python Data Science Handbook,Jake VanderPlas,2016,Técnico,2 - Média,1,PDF,Artesanato de Software (Clean Code),Excelência técnica na linguagem base para engenharia de dados e IA.,,,22
O Dilema da Inovação,Clayton M. Christensen,1997,Técnico,1 - Baixa,1,,Conhecimento geral,Explora por que grandes empresas falham ao inovar e como as inovações disruptivas surgem. Entender o mercado de tecnologia,,,21
The Coming Wave,"Michael Bhaskar and Mustafa Suleyma
",2023,Técnico,2 - Média,1,,Sistemas de IA & LLMs,,,,23
Speech and Language Processing,,0,Técnico,1 - Baixa,1,,Machine learning,,,,16
Dynamics of Software Development,Jim McCarthy,1995,Técnico,1 - Baixa,1,,Inteligência emocional,Como construir uma cultura de equipe produtiva e eficaz em projetos de desenvolvimento. Cultura de times,,,21
Design Patterns,Erich Gamma et al.,1994,Técnico,3 - Média-Alta,1,,Arquitetura,Use soluções clássicas para problemas recorrentes de software.,,,21
Guia Politicamente Incorreto da História do Brasil,Leandro Narloch,2009,Não Técnico,1 - Baixa,1,Estante,Sistemas de IA & LLMs,Visão alternativa da história brasileira,,,19
Guia Politicamente Incorreto da História do Mundo,Leandro Narloch,2011,Não Técnico,1 - Baixa,1,Estante,Sistemas de IA & LLMs,História com visão crítica e provocadora,,,19
Practical Statistics for Data Scientists,"Peter Bruce, Andrew Bruce",2017,Técnico,2 - Média,1,,Estatística & Incerteza,,,,22
Alan Turing: Suas Máquinas e Seus Segredos,"Sílvia Amélia Bim, Silvio Luiz Bragatto Boss",2017,Técnico,1 - Baixa,1,,IA,Biografia e análise das contribuições de Alan Turing para a computação e IA. História da Computação e IA,,,20
"Mente, Cérebro e Ciência",John Searle,1984,Técnico,1 - Baixa,1,,Sistemas de IA & LLMs,"Aborda a filosofia da mente, consciência e a relação entre mente e cérebro, com foco em IA. Fundamentos de IA e Filosofia da Mente",,,20
Meditações,Marco Aurélio,0,Não Técnico,2 - Média,1,,Biohacking & Existência,"Reflexões sobre virtude, razão e tranquilidade interior.",,,20
A Cura Quântica,Deepak Chopra,1989,Não Técnico,2 - Média,1,,Biohacking & Existência,"Explorar a conexão entre mente, corpo e espírito na cura.",,,20
O Poder da Gratidão,Louise Hay,2008,Não Técnico,2 - Média,1,,Biohacking & Existência,Cultivar a gratidão para promover a saúde e a felicidade.,,,20
A Magia,Rhonda Byrne,2012,Não Técnico,2 - Média,1,,Biohacking & Existência,Praticar a gratidão para transformar a vida.,,,20
O Segredo,Rhonda Byrne,2006,Não Técnico,2 - Média,1,,Biohacking & Existência,"Descobrir o ""segredo"" para manifestar desejos e alcançar objetivos.",,,20
A Lei da Atração,Michael J. Losier,2007,Não Técnico,2 - Média,1,,Desenvolvimento pessoal,Compreender e aplicar os princípios da Lei da Atração.,,,20
O Poder do Agora na Prática,Eckhart Tolle,2001,Não Técnico,2 - Média,1,,Biohacking & Existência,Exercícios práticos para aplicar os ensinamentos de O Poder do Agora.,,,20
A Arte da Felicidade,"Dalai Lama, Howard C. Cutler",1998,Não Técnico,2 - Média,1,,Biohacking & Existência,Buscar a felicidade através da sabedoria budista.,,,20
A Morte é um Dia que Vale a Pena Viver,Ana Claudia Quintana Arantes,2016,Não Técnico,2 - Média,1,,Sistemas de IA & LLMs,Refletir sobre a vida e a finitude de forma leve e profunda.,,,20
Pratical MLOps,"Noah Gift, Alfredo Deza",2021,Técnico,2 - Média,1,PDF,Engenharia de ML & MLOps,,,,20
O Cérebro de Buda,Rick Hanson,2009,Não Técnico,2 - Média,1,,Biohacking & Existência,Aplicar a neurociência para cultivar a felicidade e a resiliência.,,,20
O Conto da Aia,Margaret Atwood,1985,Não Técnico,2 - Média,1,,Épicos & Ficção Reflexiva,"Reflexão sobre opressão, gênero e controle social.",,,22
Wuthering Heights,Emily Brontë,1847,Não Técnico,2 - Média,1,,Épicos & Ficção Reflexiva,"Romance intenso sobre paixão, vingança e tragédia.",,,22
Beloved,Toni Morrison,1987,Não Técnico,2 - Média,1,,História/Ficção,Explora os traumas da escravidão e a busca por liberdade.,,,22
A Hora da Estrela,Clarice Lispector,1977,Não Técnico,2 - Média,1,,Literatura Brasileira Clássica,"Reflexão sobre a condição humana e a existência, com estilo único.",,,20
Drácula,Bram Stoker,1897,Não Técnico,2 - Média,1,,História/Ficção,"Clássico do terror gótico, explora o bem e o mal.",,,22
Noite,Elie Wiesel,1960,Não Técnico,2 - Média,1,,História/Ficção,Testemunho impactante sobre a experiência no campo de concentração.,,,22
Jane Eyre,Charlotte Brontë,1847,Não Técnico,2 - Média,1,,História/Ficção,Romance gótico sobre independência feminina e superação.,,,22
A Metamorfose,Franz Kafka,1915,Não Técnico,2 - Média,1,,Épicos & Ficção Reflexiva,Crítica à burocracia e à alienação na sociedade moderna.,,,22
O herói e o fora da lei: Como construir marcas extraordinárias usando o poder dos arquétipos, Carol S. Pearson,2022,Não Técnico,1 - Baixa,1,,Sistemas de IA & LLMs,Explorar a fronteira tecnológica e seus impactos na sociedade.,,,17
Essencialismo: A Disciplinada Busca por Menos,Greg McKeown,2014,Não Técnico,2 - Média,1,,Sistemas de IA & LLMs,Focar no que é essencial e eliminar o que não é para maior produtividade e clareza.,,,20
Mindset: A Nova Psicologia do Sucesso,Carol S. Dweck,2006,Não Técnico,2 - Média,1,,Arquitetura da Mente (Mindset),Compreender a diferença entre mentalidade fixa e de crescimento e como isso afeta o sucesso.,,,20
O Mito do Empreendedor,Michael E. Gerber,1986,Não Técnico,3 - Média-Alta,1,,Negócios,Entender os desafios de gerenciar um negócio e evitar armadilhas comuns.,,,20
Data science handbook,Jake Klamka,2020,Técnico,2 - Média,1,PDF,Estatística & Incerteza,"The Data Science Handbook is a compilation of in-depth interviews with 25 remarkable data scientists, where they share their insights, stories, and advice.",,,22
Padrões para Kubernetes,Bilgin Ibryam,2019,Técnico,1 - Baixa,1,,MLOps,Melhores práticas e padrões de design para construir e operar aplicações em Kubernetes. Melhores práticas para arquitetura em nuvem,,,19
Data Mesh: Delivering Data-Driven Value at Scale,Zhamak Dehghani,2022,Técnico,1 - Baixa,1,,Engenharia de dados,A nova abordagem descentralizada de dados.,,,19
Fundamentals of Data Engineering,"Joe Reis, Matt Housley",2022,Técnico,1 - Baixa,1,,Engenharia de ML & MLOps,Construa base sólida em engenharia de dados moderna.,,,19
